{
  "contest": "CUMCM",
  "problem_id": "huadong_cup_a",
  "question_count": 2,
  "attachments": [],
  "units": [],
  "time_ranges": [],
  "risk_words": [
    "分别",
    "最大",
    "规划",
    "表",
    "给出"
  ],
  "subquestions": [
    {
      "id": "Q1",
      "title": "问题 1",
      "text": "问题 1. 请为不同类别的游客（普通游客、家庭亲子游、情侣游）分别给出工作日、双休日、节假日的游览路线规划建议。",
      "task_type": "optimization",
      "input_data": [],
      "required_output": [
        "问题 1. 请为不同类别的游客（普通游客、家庭亲子游、情侣游）分别给出工作日、双休日、节假日的游览路线规划建议"
      ],
      "decision_object": "工作日、双休日、节假日的游览路线规划建议",
      "constraints": [],
      "units": [],
      "time_ranges": [],
      "attachments": [],
      "implicit_scoring_points": [
        "feasibility check",
        "constraint violation check",
        "baseline scheme comparison"
      ],
      "risk_words": [
        "分别",
        "规划",
        "给出"
      ],
      "warnings": [
        "input_data 未识别到附件依赖",
        "constraints 未识别到明确约束"
      ]
    },
    {
      "id": "Q2",
      "title": "问题 2",
      "text": "问题 2. 游客在游览时，可以通过手机 APP 实时查询各游览项目的排队情况。请根据实时排队情况，对问题 1 给出的规划路线进行调整。",
      "task_type": "optimization",
      "input_data": [],
      "required_output": [
        "请根据实时排队情况，对问题 1 给出的规划路线进行调整"
      ],
      "decision_object": "规划路线进行调整",
      "constraints": [],
      "units": [],
      "time_ranges": [],
      "attachments": [],
      "implicit_scoring_points": [
        "feasibility check",
        "constraint violation check",
        "baseline scheme comparison"
      ],
      "risk_words": [
        "规划",
        "给出"
      ],
      "warnings": [
        "input_data 未识别到附件依赖",
        "constraints 未识别到明确约束"
      ]
    }
  ],
  "warnings": [
    "Q1: input_data 未识别到附件依赖",
    "Q1: constraints 未识别到明确约束",
    "Q2: input_data 未识别到附件依赖",
    "Q2: constraints 未识别到明确约束"
  ]
}