{
  "contest": "CUMCM",
  "problem_id": "cumcm_2025_a",
  "question_count": 5,
  "attachments": [
    "result1.xlsx",
    "result2.xlsx",
    "result3.xlsx"
  ],
  "units": [
    "2025 年",
    "1 s",
    "3 m/s",
    "10 m",
    "20 s",
    "300 m/s",
    "7 m",
    "3 枚",
    "5 架",
    "70~140 m/s",
    "1 枚",
    "120 m/s",
    "1.5 s",
    "3.6 s",
    "3 架"
  ],
  "time_ranges": [
    "1 s",
    "20 s",
    "1.5 s",
    "3.6 s"
  ],
  "risk_words": [
    "分别",
    "连续",
    "至少",
    "至多",
    "尽可能",
    "附件",
    "给出"
  ],
  "subquestions": [
    {
      "id": "Q1",
      "title": "问题 1",
      "text": "问题 1 利用无人机 FY1 投放 1 枚烟幕干扰弹实施对 M1 的干扰，若 FY1 以 120 m/s 的速度朝向假目标方向飞行，受领任务 1.5 s 后即投放 1 枚烟幕干扰弹，间隔 3.6 s 后起爆。请给出烟幕干扰弹对 M1 的有效遮蔽时长。",
      "task_type": "simulation",
      "input_data": [
        "attachment:result1.xlsx",
        "attachment:result2.xlsx",
        "attachment:result3.xlsx"
      ],
      "required_output": [
        "请给出烟幕干扰弹对 M1 的有效遮蔽时长"
      ],
      "decision_object": "烟幕干扰弹对 M1 的有效遮蔽时长",
      "constraints": [
        "问题 1 利用无人机 FY1 投放 1 枚烟幕干扰弹实施对 M1 的干扰，若 FY1 以 120 m/s 的速度朝向假目标方向飞行，受领任务 1.5 s 后即投放 1 枚烟幕干扰弹，间隔 3.6 s 后起爆"
      ],
      "units": [
        "1 枚",
        "120 m/s",
        "1.5 s",
        "3.6 s"
      ],
      "time_ranges": [
        "1.5 s",
        "3.6 s"
      ],
      "attachments": [
        "result1.xlsx",
        "result2.xlsx",
        "result3.xlsx"
      ],
      "implicit_scoring_points": [],
      "risk_words": [
        "给出"
      ],
      "warnings": []
    },
    {
      "id": "Q2",
      "title": "问题 2",
      "text": "问题 2 利用无人机 FY1 投放 1 枚烟幕干扰弹实施对 M1 的干扰，确定 FY1 的飞行方向、飞行速度、烟幕干扰弹投放点、烟幕干扰弹起爆点，使得遮蔽时间尽可能长。",
      "task_type": "optimization",
      "input_data": [
        "attachment:result1.xlsx",
        "attachment:result2.xlsx",
        "attachment:result3.xlsx"
      ],
      "required_output": [
        "问题 2 利用无人机 FY1 投放 1 枚烟幕干扰弹实施对 M1 的干扰，确定 FY1 的飞行方向、飞行速度、烟幕干扰弹投放点、烟幕干扰弹起爆点，使得遮蔽时间尽可能长"
      ],
      "decision_object": "FY1 的飞行方向、飞行速度、烟幕干扰弹投放点、烟幕干扰弹起爆点",
      "constraints": [
        "问题 2 利用无人机 FY1 投放 1 枚烟幕干扰弹实施对 M1 的干扰，确定 FY1 的飞行方向、飞行速度、烟幕干扰弹投放点、烟幕干扰弹起爆点，使得遮蔽时间尽可能长"
      ],
      "units": [
        "1 枚"
      ],
      "time_ranges": [],
      "attachments": [
        "result1.xlsx",
        "result2.xlsx",
        "result3.xlsx"
      ],
      "implicit_scoring_points": [
        "feasibility check",
        "constraint violation check",
        "baseline scheme comparison"
      ],
      "risk_words": [
        "尽可能"
      ],
      "warnings": []
    },
    {
      "id": "Q3",
      "title": "问题 3",
      "text": "问题 3 利用无人机 FY1 投放 3 枚烟幕干扰弹，实施对 M1 的干扰。请给出烟幕干扰弹的投放策略，并将结果保存到文件 result1.xlsx 中（模板文件见附件）。",
      "task_type": "optimization",
      "input_data": [
        "attachment:result1.xlsx"
      ],
      "required_output": [
        "请给出烟幕干扰弹的投放策略，并将结果保存到文件 result1.xlsx 中（模板文件见附件）"
      ],
      "decision_object": "烟幕干扰弹的投放策略",
      "constraints": [
        "问题 3 利用无人机 FY1 投放 3 枚烟幕干扰弹，实施对 M1 的干扰",
        "请给出烟幕干扰弹的投放策略，并将结果保存到文件 result1.xlsx 中（模板文件见附件）"
      ],
      "units": [
        "3 枚"
      ],
      "time_ranges": [],
      "attachments": [
        "result1.xlsx"
      ],
      "implicit_scoring_points": [
        "feasibility check",
        "constraint violation check",
        "baseline scheme comparison"
      ],
      "risk_words": [
        "附件",
        "给出"
      ],
      "warnings": []
    },
    {
      "id": "Q4",
      "title": "问题 4",
      "text": "问题 4 利用 FY1、FY2、FY3 等 3 架无人机，各投放 1 枚烟幕干扰弹，实施对 M1 的干扰。请给出烟幕干扰弹的投放策略，并将结果保存到文件 result2.xlsx 中（模板文件见附件）。",
      "task_type": "optimization",
      "input_data": [
        "attachment:result2.xlsx"
      ],
      "required_output": [
        "请给出烟幕干扰弹的投放策略，并将结果保存到文件 result2.xlsx 中（模板文件见附件）"
      ],
      "decision_object": "烟幕干扰弹的投放策略",
      "constraints": [
        "问题 4 利用 FY1、FY2、FY3 等 3 架无人机，各投放 1 枚烟幕干扰弹，实施对 M1 的干扰",
        "请给出烟幕干扰弹的投放策略，并将结果保存到文件 result2.xlsx 中（模板文件见附件）"
      ],
      "units": [
        "3 架",
        "1 枚"
      ],
      "time_ranges": [],
      "attachments": [
        "result2.xlsx"
      ],
      "implicit_scoring_points": [
        "feasibility check",
        "constraint violation check",
        "baseline scheme comparison"
      ],
      "risk_words": [
        "附件",
        "给出"
      ],
      "warnings": []
    },
    {
      "id": "Q5",
      "title": "问题 5",
      "text": "问题 5 利用 5 架无人机，每架无人机至多投放 3 枚烟幕干扰弹，实施对 M1、M2、M3 等 3 枚来袭导弹的干扰。请给出烟幕干扰弹的投放策略，并将结果保存到文件 result3.xlsx 中\n（模板文件见附件）。",
      "task_type": "optimization",
      "input_data": [
        "attachment:result3.xlsx"
      ],
      "required_output": [
        "请给出烟幕干扰弹的投放策略，并将结果保存到文件 result3.xlsx 中 （模板文件见附件）"
      ],
      "decision_object": "烟幕干扰弹的投放策略",
      "constraints": [
        "问题 5 利用 5 架无人机，每架无人机至多投放 3 枚烟幕干扰弹，实施对 M1、M2、M3 等 3 枚来袭导弹的干扰",
        "请给出烟幕干扰弹的投放策略，并将结果保存到文件 result3.xlsx 中 （模板文件见附件）"
      ],
      "units": [
        "5 架",
        "3 枚"
      ],
      "time_ranges": [],
      "attachments": [
        "result3.xlsx"
      ],
      "implicit_scoring_points": [
        "feasibility check",
        "constraint violation check",
        "baseline scheme comparison"
      ],
      "risk_words": [
        "至多",
        "附件",
        "给出"
      ],
      "warnings": []
    }
  ],
  "warnings": []
}